{
  "schema_version": "1.0.0",
  "source": {
    "type": "manual",
    "title": "Sample Video for Testing",
    "duration_ms": 120000
  },
  "language": "ja",
  "generated_at": "2025-01-01T00:00:00.000Z",
  "items": [
    {
      "start_ms": 0,
      "end_ms": 5000,
      "text": "皆さん、こんにちは。今日の動画へようこそ。"
    },
    {
      "start_ms": 5000,
      "end_ms": 12000,
      "text": "今回は、動画制作の基本についてお話しします。"
    },
    {
      "start_ms": 12000,
      "end_ms": 20000,
      "text": "まず最初に、構成を考えることが大切です。"
    },
    {
      "start_ms": 20000,
      "end_ms": 30000,
      "text": "視聴者が何を知りたいのか、どんな順番で伝えるのかを整理しましょう。"
    },
    {
      "start_ms": 30000,
      "end_ms": 45000,
      "text": "次に、映像と音声の品質について考えます。良い照明と音声は視聴者の体験を大きく向上させます。"
    },
    {
      "start_ms": 45000,
      "end_ms": 60000,
      "text": "編集では、不要な部分をカットし、テンポよく仕上げることが重要です。"
    },
    {
      "start_ms": 60000,
      "end_ms": 75000,
      "text": "BGMや効果音を適切に使うことで、動画に深みが出ます。"
    },
    {
      "start_ms": 75000,
      "end_ms": 90000,
      "text": "字幕を入れることで、アクセシビリティも向上します。"
    },
    {
      "start_ms": 90000,
      "end_ms": 105000,
      "text": "最後に、サムネイルとタイトルも重要です。これが視聴者の第一印象になります。"
    },
    {
      "start_ms": 105000,
      "end_ms": 120000,
      "text": "それでは、実際に動画を作ってみましょう。ご視聴ありがとうございました。"
    }
  ]
}
